{
  "date": "2026-02-20",
  "topic_fingerprint": "workplace_touch_base",
  "category": "oral",
  "topic": "workplace",
  "scene": {
    "context": "You want to briefly connect with a colleague about a project or task. This is common in American workplaces for quick check-ins without scheduling a formal meeting.",
    "formality": "neutral"
  },
  "expressions": [
    {
      "phrase": "Let's touch base",
      "pronunciation_tip": "Sounds like 'touch base', not 'touch bases'. It comes from baseball!",
      "usage_note": "Use this when you want to have a brief, informal check-in. Very common in American business culture."
    },
    {
      "phrase": "Can we touch base on this?",
      "pronunciation_tip": "Natural speed: 'Can-we-touch-base-on-this' flows together.",
      "usage_note": "Add 'on this' when referring to a specific topic or project."
    }
  ],
  "alternatives": [
    "Let's sync up",
    "Can we catch up briefly?",
    "Let's check in",
    "Do you have a minute to connect?"
  ],
  "chinglish_trap": {
    "wrong": "Let's discuss together. / I want to communicate with you.",
    "correct": "Let's touch base. / Can we sync up?",
    "explanation": "Chinese speakers often translate directly, using 'discuss together' or 'communicate with you', which sounds formal and awkward in casual workplace settings. 'Touch base' is the natural American way to suggest a quick check-in."
  },
  "examples": [
    {
      "situation": "Morning standup meeting",
      "dialogue": [
        "A: Hey, I haven't seen the latest mockups. Can we touch base on those?",
        "B: Sure, I'll swing by your desk after lunch.",
        "A: Perfect, thanks!"
      ]
    },
    {
      "situation": "Email follow-up",
      "dialogue": [
        "A: I'm heading into a meeting, but let's touch base later about the client presentation.",
        "B: Sounds good. I'll be free around 3.",
        "A: Great, I'll ping you then."
      ]
    }
  ],
  "extended_learning": {
    "related_phrases": [
      "circle back - return to a topic later",
      "loop in - include someone in communication",
      "keep in the loop - keep someone informed"
    ],
    "cultural_note": "The phrase 'touch base' comes from baseball, where runners must touch each base to score. In business, it means making brief contact to share updates or align on goals. Americans use this several times per day in corporate settings!",
    "common_mistakes": [
      "Saying 'touch bases' (wrong plural)",
      "Using it for long, formal meetings (it implies brevity)",
      "Not following up after saying you'll 'touch base'"
    ]
  },
  "references": {
    "dictionary": {
      "source": "merriam-webster",
      "url": "https://www.merriam-webster.com/dictionary/touch%20base",
      "note": "Official definition and usage examples"
    },
    "usage_context": {
      "source": "youglish",
      "url": "https://youglish.com/pronounce/touch%20base/english/us",
      "note": "Hear it in 1000+ real YouTube videos"
    },
    "etymology": {
      "source": "etymonline",
      "url": "https://www.etymonline.com/word/touch",
      "note": "From baseball: runners must touch each base to score"
    }
  },
  "display": {
    "title": "ğŸ¢ ä»Šæ—¥çŸ¥è¯†ç‚¹ | Today's Knowledge Point",
    "topic_tag": "ğŸ·ï¸ ä¸»é¢˜: èŒåœºå£è¯­ | Workplace Oral",
    "formality_tag": "ğŸ“Š æ­£å¼åº¦: ä¸­æ€§ | Neutral",
    "scene_intro": "ğŸ¬ åœºæ™¯ | Scene",
    "scene_text": "Quick check-in with colleagues without scheduling a formal meeting.",
    "expressions_title": "ğŸ’¬ æ ¸å¿ƒè¡¨è¾¾ | Key Expressions",
    "expressions_formatted": [
      {
        "emoji": "âœ¨",
        "phrase": "**Let's touch base**",
        "phrase_plain": "Let's touch base",
        "pronunciation": "ğŸ”Š Sounds like 'touch base' (not 'bases')! From baseball âš¾",
        "usage": "ğŸ’¡ Brief, informal check-in."
      },
      {
        "emoji": "âœ¨",
        "phrase": "**Can we touch base on this?**",
        "phrase_plain": "Can we touch base on this?",
        "pronunciation": "ğŸ”Š Flows: Can-we-touch-base-ON-this.",
        "usage": "ğŸ’¡ Use when referring to a specific topic."
      }
    ],
    "alternatives_title": "ğŸ”„ å…¶ä»–è¯´æ³• | Alternatives",
    "alternatives_formatted": "â€¢ **Let's sync up**\nâ€¢ **Can we catch up briefly?**\nâ€¢ **Let's check in**\nâ€¢ Do you have a minute to connect?",
    "chinglish_title": "âš ï¸ Chinglish é™·é˜± | Chinglish Trap",
    "chinglish_formatted": "âŒ Wrong: \"Let's discuss together.\"\nâŒ Wrong: \"I want to communicate with you.\"\nâœ… Correct: **Let's touch base!**\nâœ… Correct: **Can we sync up?**\n\nğŸ“ Why? Direct translation sounds formal and awkward. **Touch base** is the natural American way!",
    "examples_title": "ğŸ—£ï¸ å¯¹è¯ç¤ºä¾‹ | Example Dialogues",
    "examples_formatted": [
      {
        "situation_emoji": "â˜•",
        "situation": "Morning standup",
        "dialogue": "ğŸ’¬ A: Hey, can we **touch base** on those mockups?\nğŸ’¬ B: Sure, I'll swing by after lunch.\nğŸ’¬ A: Perfect, thanks!",
        "key_phrase_highlight": "**touch base**"
      },
      {
        "situation_emoji": "ğŸ“§",
        "situation": "Email follow-up",
        "dialogue": "ğŸ’¬ A: Let's **touch base** later about the presentation.\nğŸ’¬ B: Sounds good. Free around 3?\nğŸ’¬ A: Great, I'll ping you then!",
        "key_phrase_highlight": "**touch base**"
      }
    ],
    "extended_title": "ğŸ“š å»¶ä¼¸å­¦ä¹  | Extended Learning",
    "extended_formatted": "ğŸ”— Related: **circle back** | **loop in** | **keep in the loop**\n\nğŸŒ Cultural Note: From baseball âš¾ - runners **touch** each **base** to score. Americans use this phrase several times a day!\n\nğŸš« Common Mistakes:\n  â€¢ Saying 'touch bases' âŒ\n  â€¢ Using for long meetings (it implies brevity)\n  â€¢ Not following up",
    "references_title": "ğŸ“– æƒå¨å‚è€ƒ | References",
    "references_formatted": "ğŸ“š [Merriam-Webster](https://www.merriam-webster.com/dictionary/touch%20base) - Definition & examples\nğŸ¬ [YouGlish](https://youglish.com/pronounce/touch%20base/english/us) - 1000+ YouTube videos\nğŸ“œ [Etymonline](https://www.etymonline.com/word/touch) - Word origin",
    "footer": "â”€â”€â”€â”€â”€â”€â”€â”€â”€â”€â”€â”€â”€â”€â”€â”€â”€â”€â”€\nğŸ“… 2026-02-20 | ğŸ“ Take the quiz to earn XP!"
  },
  "audio": {
    "enabled": true,
    "narrator": "audio/2026-02-20/narrator.mp3",
    "dialogue": []
  },
  "generated": true
}
